{
  "schema_version": 1,
  "plan_id": "PLAN-0190",
  "ea": "Fibonacci_EA_v5_0",
  "feasible": true,
  "status": "pass",
  "reason": "All requested parameters exist in EA source and are compatible with EA architecture.",
  "required_changes": [
    {
      "parameter": "InpTP1ClosePct",
      "type": "double",
      "before": "50.0",
      "after": "75.0",
      "rationale": ""
    }
  ],
  "blocked_by": []
}