{
  "schema_version": 1,
  "plan_id": "PLAN-0081",
  "ea": "Fibonacci_EA_v5_0",
  "feasible": true,
  "status": "pass",
  "reason": "All requested parameters exist in EA source and are compatible with EA architecture.",
  "required_changes": [
    {
      "parameter": "dataset_partition",
      "type": "dataset_partition",
      "before": "training (2020.01.01 to 2024.12.31)",
      "after": "validation (2025.01.01 to 2025.12.31)",
      "rationale": "Walk-forward out-of-sample evaluation on unoptimized 2025 validation partition."
    }
  ],
  "blocked_by": []
}