{
  "schema_version": 1,
  "plan_id": "PLAN-0102",
  "ea": "Fibonacci_EA_v5_0",
  "feasible": true,
  "status": "pass",
  "reason": "All requested parameters exist in EA source and are compatible with EA architecture.",
  "required_changes": [
    {
      "parameter": "InpTP1Pips",
      "type": "double",
      "before": "10.0",
      "after": "15.0",
      "rationale": "Widen first take-profit target to capture larger gains on M30 candles before partial close."
    }
  ],
  "blocked_by": []
}