{
  "schema_version": 1,
  "plan_id": "PLAN-0101",
  "ea": "Fibonacci_EA_v5_0",
  "feasible": true,
  "status": "pass",
  "reason": "All requested parameters exist in EA source and are compatible with EA architecture.",
  "required_changes": [
    {
      "parameter": "timeframe",
      "type": "market_dimension",
      "before": "M30",
      "after": "H1",
      "rationale": "Transition execution chart timeframe from M30 to H1 to test higher timeframe noise reduction and synchronous swing detection."
    }
  ],
  "blocked_by": []
}