{
  "schema_version": 1,
  "plan_id": "PLAN-0134",
  "ea": "Fibonacci_EA_v5_0",
  "feasible": true,
  "status": "pass",
  "reason": "All requested parameters exist in EA source and are compatible with EA architecture.",
  "required_changes": [
    {
      "parameter": "symbol",
      "type": "market_dimension",
      "before": "GBPUSD",
      "after": "USDJPY",
      "rationale": "Evaluate champion M30 configuration across independent major currency instrument (USDJPY) to complete the 4-pair portfolio matrix."
    }
  ],
  "blocked_by": []
}